video_id,title,publishedAt,channelId,channelTitle,categoryId,trending_date,tags,view_count,likes,dislikes,comment_count,thumbnail_link,comments_disabled,ratings_disabled,description
"77fwhGMOlKw","ROOMTOUR meiner ganzen WOHNUNG | JONAS","2020-05-11T16:45:00Z","UCBcRGYoOfVFyLOYHOHJWbPg","JONAS PRIVATE",People & Blogs,"20.12.05","jonas|ems|behind|the|scenes|VLOG","122384","11392","474","644","https://i.ytimg.com/vi/77fwhGMOlKw/default.jpg","False","False","Zum ersten Mal zeige ich euch heute einmal meine gesamte Wohnung.💖 ZUM VIDEO AUF MEINEM HAUPTKANAL: https://youtu.be/oQxIxpL4F1w💠 INSTAGRAM: https://www.instagram.com/jonasems/💠 YOUTUBE: https://www.youtube.com/channel/UCBcRGYoOfVFyLOYHOHJWbPg💠 TWITCH: https://www.twitch.tv/jonasems💠 TIK TOK: https://www.tiktok.com/@jonasems📘 Jetzt meine BÜCHER bestellen: 📘 (Werbung)▸ Schattenseite (NEU): https://www.amazon.de/dp/396017053X/ref=cm_sw_em_r_mt_dp_U_XXbYDbQPV7W60▸ Die andere Verbindung: https://www.amazon.de/Die-andere-Verbindung-Jonas-Ems/dp/3960170114 🏮 Jetzt M96D Parfüm besorgen! 🏮 (Werbung)▸ Online bestellen: https://www.dm.de/search/468652.html?type=product&q=M96D&productQuery=%3Arelevance%3Abrand%3AM96D%7Cfalse▸ Und in allen DM Filialen in Deutschland & Österreich erhältlich! ------------------📸 PRODUKTEMPFEHLUNGEN 📸 (Werbung) ✨ Alle meine Empfehlungen im Überblick: https://www.amazon.de/shop/jonas* Kamera: https://amzn.to/2VmJ7Ul* Stativ: https://amzn.to/2VkmtLW* Objektiv: https://amzn.to/3aeCAPy* Beleuchtung: https://amzn.to/2ysD1Zb* Mikrofon: https://amzn.to/2VkPWWh* Kameratasche: https://amzn.to/2KcEIg8------------------(Werbung Ende)💻 Business Kontakt / Anfragen 💻▸ http://jonasems.com/▸ufonetv[at]gmail.com💀 CHECKT MEINE KANÄLE 💀▸ COMEDY KANAL: https://www.youtube.com/user/uFoneTV▸ STREAM KANAL: https://www.youtube.com/channel/UCIQ4jM0x0lnpuuiH7H8JJaw▸ NACHDENKLICH VIDEOS: https://www.youtube.com/user/uFoneTHINKS✂ Schnibbel Schnapp, er macht den Cut ✂▸ CUTTER: https://www.instagram.com/tobiaswacker/🎶 Recommended music 🎶: ▸ THEFATRAT: https://www.youtube.com/user/ThisIsTheFatRat▸ EPEDEMIC: http://epidemicsound.com/*Affiliate Links. Das heißt über die Links generierten Umsatz wird je nach messbaren Erfolg Provision gezahlt. Es bleibt euch überlassen, wo ihr die Produkte kaufen wollt :)-------------------------------------------Ich bin Jonas und drehe schon YouTube Videos seit ich 13 bin! Auf meinem Kanal ging es schon immer darum, dich zum Lachen zu bringen. Es kann dabei um Liebe, Pubertät, Schule, das Leben, Social Media, Freunde, Mädchen & Jungs Kram, peinliche Geschichten, Eltern und weitere verrückte Dinge gehen! Das Wichtigste ist: Du hast etwas, das dich vom Alltagsstress ablenkt und dir ein Lächeln (oder sogar einen Lachflash) zaubert!"
"0EmH7hHaVNQ","Gates kapert Deutschland zerlegt | WALULIS","2020-05-11T14:12:42Z","UChkVOG0PqkXIHHmkBGG15Ig","WALULIS",Entertainment,"20.12.05","KenJebsen|KenFM|Jebsen|Verschwörung|Verschwörungstheorie|Verschwörungstheoretiker|NWO|NewWorldOrder|BillGates|Gates|MelindaGates|Bill|Melinda|Corona|Corona-Pandemie|Impfgegner|Impfpflicht|Zwangsimpfung|FakeNews|Fake|Investigativ|Meinungsfreiheit|Demonstration|Demo|Deutschland|Grundgesetz|Aufklärung|Spiegel|TAZ|Fernsehen|Medien|Journalismus|Journalisten|ARD|ZDF|GEZ|Rundfunkgebühren|Demokratie","231809","24044","2450","6023","https://i.ytimg.com/vi/0EmH7hHaVNQ/default.jpg","False","False","Bill Gates - der Vater von Karl Klammer. Und Thema eines 30 minütigen Videos von YouTuber Ken Jebsen bei dem schon der Titel aufschreckt:‘Gates kapert Deutschland’ Ehrlich gesagt: Wenn das stimmt, dann fände ich das wirklich nicht geil. Ken hat also meine Aufmerksamkeit. Und nicht nur meine: Das Video hat inzwischen über drei Millionen Aufrufe. Ein Video, voll mit Aussagen, die einem wirklich Angst machen. Gerade jetzt während Corona suchen wir alle nach Antworten. Also: Was ist dran an dem Video? Wer ist Ken Jebsen? Zeit, das mal genauer zu zerlegen.→ Wir sind Teil von funk! Mehr davon gibt's unter: ►YouTube: https://youtube.com/funkofficial ►funk Web-App: https://go.funk.net ►Facebook: https://facebook.com/funk ►Impressum: https://go.funk.net/impressum → Mehr von WALULIS: ►WALULIS DAILY: https://walul.is/daily►WALULIS // Instagram: https://walul.is/instagram►WALULIS // Facebook: https://walul.is/facebook►WALULIS // Twitter: https://walul.is/twitter#WALULIS"
"iRzZGQEPwY4","Meet Loba – Apex Legends Character Trailer","2020-05-11T17:00:30Z","UC0ZV6M2THA81QT9hrVWJG3A","Apex Legends",Gaming,"20.12.05","Apex Legends|Apex|Apex Legends characters|Fortune’s Favor|Updated Map|Updated Kings Canyon|Season Quests|The Broken Ghost|Apex Legends Quest|Apex Legends Battle Pass|Season 5 Battle Pass|Apex Legends new season|Apex Legends game|Respawn Apex Legends|Battle Royale game|Battle Royale|Battle Royale shooter|Apex Games|squad play|multiplayer shooter|ps4|Xbox|PC|Origin|Respawn Entertainment|Electronic Arts|Titanfall 2|EA|Respawn|fun battle royale","3817886","163562","2322","19097","https://i.ytimg.com/vi/iRzZGQEPwY4/default.jpg","False","False","The best thief in the Outlands, Loba uses her Jump Drive bracelet to teleport where she wants and take what she pleases. http://x.ea.com/63058When she was nine years old, Loba Andrade witnessed her parents’ murders at the hands of the simulacrum Revenant. Left to her own devices, Loba used her natural knack for thievery to claw her way into a high society life. With Revenant's reemergence at the Apex Games, she’s determined to use her unique skills to claim her revenge. And whatever loot she can get her hands on. Loba has a keen eye for valuables -- so keen she can see top-tier loot through walls. She uses her Jump Drive bracelet to teleport out of dangerous situations or enter lucrative ones. And she can even pull valuable loot to her Black Market Boutique, allowing her squad to load up on all the best gear. Ready to steal the show?Learn more about Loba’s story: https://www.youtube.com/watch?v=RH3Rp80rbkQ Apex Legends™ is a free-to-play battle royale game where legendary characters battle for glory, fame, and fortune on the fringes of the Frontier. Play for free now on Xbox One, PlayStation 4, and Origin for PC: http://x.ea.com/63044.  Check out our YouTube channel:Follow us on Twitter: https://twitter.com/playapex.Follow us on Instagram: https://www.instagram.com/playapex/. #PlayApex #ApexSeason5 #ApexSeasonFive #ApexLegends"
"C-WGkqifTiI","Heimlich Reinmogeln: Welche Taktik funktioniert? | Late Night Berlin | ProSieben","2020-05-11T22:00:03Z","UCBlOtMAWn6nQpChhRo14CYA","Late Night Berlin",Entertainment,"20.12.05","Heimlich Reinmogeln: Welche Taktik funktioniert?|Heimlich reinmogeln|Welche Taktik funktioniert|reinmogeln|reinschmuggeln|heimlich|heimlich veranstaötung|reinmogeln veranstaltung|auf veranstaltung reinmogeln|veranstaltung|Late Night Berlin|Klaas Late Night|Late|Night|Berlin|Klaas|Klaas Heufer-Umlauf|Circus HalliGalli|Joko und Klaas|Joko|Joko Winterscheidt|Klas|Claas|ProSieben|Late Night Show|Show|TV Show|Sendung|TV Sendung|TV","186269","11864","259","524","https://i.ytimg.com/vi/C-WGkqifTiI/default.jpg","False","False","Genau eine Woche vor den Corona Maßnahmen in Deutschland hat das LNB-Team einen Einspieler gedreht, in dem es darum geht, ob man es mit diversen Tricks schafft, sich in den Zoo oder auf ein Konzert zu mogeln. Das Ganze ist viel zu spannend und informativ, um es im Giftschrank vergammeln zu lassen, also ab dafür!#Reinmogeln #LateNightBerlin #ProSieben► Late Night Berlin – Ganze Folgen & alle Videos: http://bit.ly/LNBGanzeFolge ► Late Night Berlin abonnieren: http://bit.ly/LNBAbonnieren► Late Night Berlin in einer Playlist: http://bit.ly/LNBAlleClips► FACEBOOK: https://www.facebook.com/LateNightBerlin/ ► TWITTER: https://twitter.com/latenightberlin► INSTAGRAM: https://instagram.com/latenightberlin/***************************************Die feste Verabredung am Montagabend: Popkultur, Politik, Musik, Sport, Gesellschaft und Medien – Klaas Heufer-Umlauf kommentiert und diskutiert die wirklich wichtigen Themen und ist dabei ganz subjektiv. Woche für Woche sendet ProSieben die neue Late-Night-Show für Deutschland direkt aus Berlin, der Stadt, die Trends setzt.Montags, 23:10 Uhr auf ProSieben.Impressum:   http://www.studio71.com/de/impressum/"
"mtLwnQJwelY","700-PS-Tuning-Duell | Techart GTStreet RS vs. TIKT AMG GTR Pro Bastard | GRIP","2020-05-10T18:00:09Z","UCak3selG2oi5vn7sbqdaULA","GRIP - Das Motormagazin",Autos & Vehicles,"20.12.05","GRIP|RTL2|Motormagazin|Matthias Malmedie|Philipp Kaess|Techart GTStreet RS|TIKT AMG GTR Pro Bastard Tuning 700 PS|300 km/h|Autobahn|Porsche","642786","22846","482","1572","https://i.ytimg.com/vi/mtLwnQJwelY/default.jpg","False","False","Die GRIP-Testfahrer Matthias Malmedie und Philipp Kaess battlen sich mit den schärfsten Tuningautos, die es aktuell in Deutschland gibt. Techart GTStreet RS und TIKT AMG GTR Pro Bastard. 1.500 PS im Duell! Schärferes Tuning geht nicht! Komplette Folgen GRIP bei TV NOW: http://www.tvnow.de/rtl2/grip-das-motormagazinAlle Infos zur Sendung: http://www.rtl2.de/sendung/grip-das-motormagazinGRIP bei Facebook: https://www.facebook.com/gripGRIP bei YouTube abonnieren: http://www.youtube.com/subscription_center?add_user=GRIPRTL2GRIP - Das Motormagazin, immer sonntags im TV bei RTL2."
"NybxlGTCia4","XXL KÜCHENGADGETS ÜBERRASCHUNGSPAKET von @Sallys Welt","2020-05-11T10:00:08Z","UCtmpz7ZiNbRQPdvz607X_gA","Sturmwaffel",Entertainment,"20.12.05","kochen|sturmwaffel|backen|küche","124684","9830","139","411","https://i.ytimg.com/vi/NybxlGTCia4/default.jpg","False","False","►DANKE an Sally! https://www.youtube.com/user/sallystortenwelt►Sallys Shop: https://sallys-shop.de/►Zweiter Kanal: https://www.youtube.com/waffelbande►MERCH**: https://www.sturmwaffel.de►Mein Podcast: https://bit.ly/2CHghVs►Gaming Stuhl*: https://bit.ly/2XC0B0q►Podcast Spotify: https://spoti.fi/2FuO6dF►Discord: https://discord.gg/ta9PDcP_____________►Social►Twitch: http://www.twitch.tv/Sturmwaffel►Twitter: https://twitter.com/Sturmwaffel►Instagram: http://instagram.com/instawaffel►Facebook: https://www.facebook.com/Sturmwaffel►►Videos geschnitten von Miguel: https://bit.ly/39PZaPH►►Miguel Foto Presets: https://sellfy.com/migueldorset♥Waffelbande♥* Die mit * gekennzeichneten Links sind Affiliate Links. Wenn du dieses Produkt kaufen solltest, werde ich am Umsatz beteiligt. Für dich entstehen dabei keine Mehrkosten.** Die mit ** gekennzeichneten Links stellen Werbung dar"
"Gp4BieYK1zI","André gesteht Mandy seine Liebe 💬❤️ #2189 | Berlin - Tag & Nacht","2020-05-11T18:15:00Z","UC6hmAN2FLzB8-Fzzu7evKgA","Berlin - Tag & Nacht",Entertainment,"20.12.05","berlin - tag & nacht|berlin tag und nacht|btn|rtl2|preview|ganze folge|tv now|Berlin|berlin tag und nacht preview|berlin tag und nacht ganze folge|berlin tag und nacht vorschau|tägliche highlights|rtlzwei|Hausboot-WG|Mandy|André|Andre|btn mandy|btn andre","542399","21205","331","1032","https://i.ytimg.com/vi/Gp4BieYK1zI/default.jpg","False","False","André kommt endlich zurück nach Berlin und Mandy ist Feuer und Flamme. Endlich ist ihre Familie wieder vollständig. Doch André hat nur Augen für seinen Sohn...hat er wirklich Gefühle für Mandy???Die gescriptete Reality-Soap „Berlin - Tag & Nacht“ zeigt die coolste WG Berlins, mit Themen wie  Freundschaft, Liebe,  Eifersucht, Affären, Glück, Freude und Leiden. Wie im echten Leben eben!Alte wie neue WG-Bewohner, u. a. Ole, Joe, Peggy, Krätze, Schmidti, Eule, Basti Paula, Piet, Milla, Leon und viele weitere, zeigen dir ihr Leben in Berlin, der bunten Metropole Deutschlands. Sie nehmen dich mit in ihre Wohngemeinschaften, auf ihre Arbeitsplätze, in den Club Matrix, den Friseursalon „Schnitte“ sowie die Bar LA 14. Auch ein Tattoostudio und das Fitnessstudio Body Burn gehören zu den unterschiedlichen und wechselnden Handlungsorten der Serie. Die Großstadt-Soap „Berlin – Tag & Nacht“ ist nicht zuletzt deshalb so beliebt, weil sie die Bewohner der WGs im Ringen mit alltäglichen Problemen zeigt: Affäre und Eifersucht, Erfolgsdruck im Beruf sowie viele zwischenmenschliche Konflikte. Berlin - Tag & Nacht läuft Montag bis Freitag um 19:05 Uhr bei RTLZWEI. Instagram: http://www.instagram.com/berlintagundnachtZur Webseite: http://www.rtl2.de/sendung/berlin-tag-und-nachtKomplette Folgen auf TVNOW: http://www.tvnow.de/rtl2/berlin-tag-nachtZur BTN-App: https://www.rtl2.de/sendungen/berlin-tag-nacht/appFacebook: http://www.facebook.com/berlintagundnachtTwitter: http://twitter.com/rtl2"
"lcSu6Bv3lrc","McFit in Köln-Kalk: Riesen Andrang bei Wiedereröffnung der Fitnessstudios um Mitternacht nach Corona","2020-05-11T07:35:46Z","UCRrPg7t_nw-v2dh5UhmDoDw","EXPRESS",News & Politics,"20.12.05","köln|fitnessstudio|mcfit|sport|fitness|corona|coronavirus","203557","921","2070","0","https://i.ytimg.com/vi/lcSu6Bv3lrc/default.jpg","True","False","Durch die Lockerungen der Corona-Regeln dürfen Fitnessstudios wieder öffnen. In der Nacht zu Montag bildete sich um Mitternacht eine Schlange vor dem McFit in Köln-Kalk."
"wL_mpYyLJIE","Schweden ohne Lockdown | ARTE Re:","2020-05-11T10:00:39Z","UCLLibJTCy3sXjHLVaDimnpQ","ARTEde",News & Politics,"20.12.05","Schweden doku|schweden coronavirus|schweden dokumentation|schweden lockdown|schweden ohne lockdown|schweden lockdown beendet|corona pandemie|coronavirus|corona|schweden","160152","2613","162","1733","https://i.ytimg.com/vi/wL_mpYyLJIE/default.jpg","False","False","Die Länder Europas greifen in der Corona-Pandemie zu drastischen Maßnahmen. Nur Schweden wählt einen Sonderweg: Das Leben wird kaum eingeschränkt. Restaurants, Läden, Schulen, Kitas haben geöffnet. Das Ziel: Massenimmunität. Aber die Kritik an dem Konzept wächst. Immer mehr Wissenschaftler warnen vor katastrophalen Folgen.Schweden wählt beim Umgang mit der Corona-Pandemie einen Sonderweg: Kitas und Schulen sind geöffnet, Cafés und Restaurants bewirten Gäste, die Einkaufsstraßen sind gut besucht. Nur die alten Menschen werden isoliert und Großveranstaltungen abgesagt. Die meisten Einwohner unterstützen das Konzept, auch die Stockholmer Familie Lindstrand. Die Familie mit drei Kindern achtet auf soziale Distanz. Sie sind aber froh, dass Restaurantbesuch und Einkaufsbummel noch möglich sind. Doch es mehren sich kritische Stimmen, weiß die Journalistin Mia Pettersson. Immer mehr Ärzte kritisieren, dass das Gesundheitssystem des Landes zu schlecht vorbereitet ist.Reportage (D 2020, 33 Min)►Video auf Youtube verfügbar bis zum 02/08/20►Abonniert den Youtube-Kanal von ART/:  http://www.youtube.com/user/ARTEdeFolgt uns in den sozialen Netzwerken: Facebook: http://www.facebook.com/ARTE.tvTwitter: https://twitter.com/ARTEdeInstagram: https://www.instagram.com/arte.tv/"
"tY-SVHNeWGs","YOUTUBER am AUGE ERKENNEN! mit @Joey's Jungle | Dillan White","2020-05-10T10:04:27Z","UCRpEJceQa8q7jdPbRCjEFMg","dillan white.",Entertainment,"20.12.05","Dillan White|joeys jungle|dillan white freundin|Youtuber erkennen|Youtuber am Auge Erkennen|Youtuber Challenge|witzig|Dillan und Joey|Joey und Dillan|Witzige Videos|Lustige Videos 2020|Kisu|Julienco|BIbi|Freshtorge|Unge|Ungeklickt|unge reagiert|Luca|concrafter|YOUTUBER am AUGE ERKENNEN! mit @Joey's Jungle|Joeys jungle dillan|Dillan Joeys Jungle|lustig|julia beautx|Dillon|Dylon|Dillon white","191978","17315","112","970","https://i.ytimg.com/vi/tY-SVHNeWGs/default.jpg","False","False","​@Joey's Jungle und ich sind mal wieder gegen einander angetreten und haben versucht Youtuber am Auge zu erraten!Konntet ihr mehr erraten als wir? ➤ Instagram: http://instagram.com/dillanxwhite➡ Alle Videos anschauen in einer Playlist: https://goo.gl/uMzNRfJoeys Video: https://youtu.be/Xvzus8hwMtsJoeys Kanal: @Joey's Jungle Kontaktadresse/Business Inquiries ➤ Management@dillanwhite.com"
"XxQ0K3hLMjs","Rasenmäher Messer schärfen - lohnt sich das überhaupt ?","2020-05-11T15:30:07Z","UCkDZzKGpfz-XJsbrExOElqg","MHM",Film & Animation,"20.12.05","Rasenmäher Messer schärfen|Rasen mähen|Messer schärfen|Rasenmähermesser|schärfen|schleifen|Rasen düngen|perfekter Rasen|Moos|Moos bekämpfen|Rasenpflege|Tipps|grüner Rasen|Rasen kalken|rasen lüften","65852","531","27","141","https://i.ytimg.com/vi/XxQ0K3hLMjs/default.jpg","False","False","🔻 Weiterführende Infos 🔻 📝 Kommentar nicht vergessen 📝Welche Erfahrung habt Ihr mit Eurem Rasenschnitt gemacht. Wie bewertet Ihr die Standzeit von Eurem Rasenmähermesser. Gebt Ihr es zum schärfen weg, erledigt Ihr es selbst, oder habt Ihr das mähen Eures Rasen eh schon komplett aufgegeben weil Moos und Löwenzahn die Oberhand haben ?Eigentlich sollte dieses Video eine ganz andere Richtung einschlagen. Beim Dreh hat sich aber herausgestellt, dass die neuen Messer (zumindestens von unserer Marke) all den geplanten Aufwand nicht wert sind. Die Standzeit ist gering - um nicht zu sagen erschreckend gering. Und auch wenn  Dominik im Video gesagt hat nach 200-300 qm einfach nachschärfen - mal im Ernst wer mag das schon machen........Daher geben wir Euch an dieser Stelle zumindestens ein paar weitere Tipps für schönen Rasen :Wer mäht sollte düngen. Bis zu 3 mal im Jahr (März-April / Juni-Juli und Herbstende)schadet nicht und die Nährstoffzugabe sorgt gleichzeitig dafür, dass sich das Moos nicht mehr ganz so wohl fühlt. Moos fühlt sich besonders wohl wenn wenig Nährstoffe vorhanden sind und der PH Wert unter 5,5 liegt. Rasen mag Nährstoffe und einen PH Wert von 5,5-6,5 (oder darüber). Mit einem PH Teststreifen, Rasenkalk und Dünger kann man somit eines der größten Ärgernisse durchaus in den Griff bekommen. Etwas Ausdauer ist hierbei durchaus gefragt - das Bodenklima verbessert sich nicht in Tagen sondern eher in 2-3 Jahren - aber die Ergebnisse sind den Aufwand durchaus wert.Vertikutieren bleibt einem, je nachdem wo man in Deutschland seine Heimat hat, jedoch nicht gänzlich erspart. Bei uns erfolgt dies einmal im Jahr nach der Winterpause (Ende März) und dann hat man eigentlich auch wieder 12 Monate Ruhe.Was jedoch gegen Löwenzahn und Maulwurf hilft haben wir bisher auch nicht nicht herausgefunden. Hier sind wir für Tipps durchaus dankbar. Ansonsten könnt Ihr mit allerlei Werkzeug oder Maschinen Eurer Rasenmäher Messer schärfen. Egal ob Metallfeile, Schärfstein, Flex, Nassschleifer, Bandschleifer und was es sonst noch so gibt. Für uns hat sich hier der Doppelschleifer eigentlich am Besten geschlagen, sofern die Werkzeugauflage groß genug und im Winkel einstellbar ist bekommt man gute Ergebnisse innerhalb kurzer Zeit. Euer Maschinenhandel Meyerhttps://www.holz-metall.info/"
"U4yv3L0XXf0","Becky Lynch announces she’s pregnant: Raw, May 11, 2020","2020-05-12T00:49:28Z","UCJ5v_MCY6GNUBTO8-D3XoAg","WWE",Sports,"20.12.05","wwe|world wrestling entertainment|wrestling|wrestler|wrestle|superstars|कुश्ती|पहलवान|डब्लू डब्लू ई|मैच|सुपरस्टार|व्यावसायिक कुश्ती|مصارعه|wwe 2020|Raw|Becky Lynch|Asuka|Byron Saxton|Tom Phillips|Samoa Joe|wwe becky lynch pregnant|becky lynch pregnant|becky lynch is pregnant|becky lynch announcement|wwe news|wwe news and rumors|raw highlights|raw highlights this week|wwe raw highlights|wwe raw women|becky lynch and seth rollins","1602404","92291","1843","14997","https://i.ytimg.com/vi/U4yv3L0XXf0/default.jpg","False","False","The Man is becoming a mom. Raw Women’s Champion Becky Lynch reveals that she’s pregnant and that she requested that WWE make the Women’s Money in the Bank Ladder Match for her title. #WWERAWGET YOUR 1st MONTH of WWE NETWORK for FREE: http://wwe.yt/wwenetwork---------------------------------------------------------------------Follow WWE on YouTube for more exciting action!---------------------------------------------------------------------Subscribe to WWE on YouTube: http://wwe.yt/Check out WWE.com for news and updates: http://goo.gl/akf0J4Watch WWE on Sony in India: http://www.wwe.com/SonySportsNetworkFind the latest Superstar gear at WWEShop: http://shop.wwe.com---------------------------------------------Check out our other channels!---------------------------------------------The Bella Twins: https://www.youtube.com/thebellatwinsUpUpDownDown: https://www.youtube.com/upupdowndownWWEMusic: https://www.youtube.com/wwemusicTotal Divas: https://www.youtube.com/wwetotaldivas------------------------------------WWE on Social Media------------------------------------Twitter: https://twitter.com/wweFacebook: https://www.facebook.com/wweInstagram: https://www.instagram.com/wwe/Reddit: https://www.reddit.com/user/RealWWEGiphy: https://giphy.com/wwe------------------------------------WWE Podcasts------------------------------------After the Bell with Corey Graves: http://bit.ly/afterthebellpodcastThe New Day: Feel the Power: https://link.chtbl.com/7Fp6uOqk"
"k8gx-C7GCGU","DAY6 Zombie M/V","2020-05-11T08:59:52Z","UCaO6TYtlC8U5ttz62hTrZgg","jypentertainment",Music,"20.12.05","JYP Entertainmnet|DAY6|데이식스|DAY6 Jae|DAY6 Young K|DAY6 Sungjin|DAY6 Wonpil|DAY6 Dowoon|DAY6 제이|DAY6 영케이|DAY6 성진|DAY6 원필|DAY6 도운|데이식스 Jae|데이식스 Young K|데이식스 제이|데이식스 영케이|데이식스 성진|데이식스 원필|데이식스 도운|Jae|Young K|Sungjin|Wonpil|Dowoon|제이|영케이|성진|원필|도운|The Book of Us|DAY6 The Book of Us|DAY6 The Book of Us The Demon|DAY6 Zombie MV|데이식스 Zombie 뮤비|The Book of Us The Demon|DAY6 Zombie|DAY6 Zombie Music Video|데이식스 뮤비|DAY6 MV","2753643","557699","1709","51294","https://i.ytimg.com/vi/k8gx-C7GCGU/default.jpg","False","False","DAY6 Zombie M/VListen to DAY6 The Book of Us : The Demon iTunes & Apple Music : https://apple.co/2YR7QCfSpotify : https://spoti.fi/2YR5OSDDAY6 Official YouTube: http://www.youtube.com/c/DAY6OfficialDAY6 Official Facebook: http://www.facebook.com/DAY6OfficialDAY6 Official Twitter: http://www.twitter.com/DAY6OfficialDAY6 Official Fan's: http://fans.jype.com/DAY6DAY6 Official Homepage: http://DAY6.jype.comCopyrights 2020 ⓒ JYP Entertainment. All Rights Reserved."
"V2Xt8xjHLdM","Markus kommentiert Brusttraining aus dem Jahr 2000 (Markus Rühl XXXL-VHS) - Teil 1","2020-05-11T22:04:05Z","UCuaNASgJXvNvbThY77Lyz2Q","MarkusRuehl",Sports,"20.12.05","Markus Rühl XXXL|VHS-Kassette|Bodybuilding","61313","4320","59","486","https://i.ytimg.com/vi/V2Xt8xjHLdM/default.jpg","False","False","Hallo Sportfreunde,ich wurde inzwischen oft auf mein erstes Trainingsvideo angesprochen. Dieses ist im Jahr 2000 ausschließlich auf VHS-Kassette erschienen. Wir haben nun das digitale Masterband neu eingespielt und erstmalig in voller Qualität in dieses Youtube-Video eingebunden.Somit könnt ihr heute die alten Aufnahmen in bester Qualität und mit meinen aktuellen Kommentaren sehen. Das Video wird in drei Teilen veröffentlicht.Habt ihr zusätzlich Interesse an einer DVD mit hinzuschaltbaren Kommentaren? Schreibt es doch bitte in die Kommentarzeile, wenn wir eine DVD aus diesen frühen Aufnahmen machen sollen.Stabile GrüßeEuer Markus"
