video_id,title,publishedAt,channelId,channelTitle,categoryId,trending_date,tags,view_count,likes,dislikes,comment_count,thumbnail_link,comments_disabled,ratings_disabled,description
"-jnfFdiXRRk","Erdbeertorte / Erdbeertorte mit Quark","2020-05-07T07:39:54.000Z","UCedE9hbOHC_YxHY0_1A151Q","Silvia W-K",People & Blogs,"20.12.05","Tipps|Tricks|Backen|Kochen|Garten|Hauswirtschaft|Home Economics","121829","3595","107","314","https://i.ytimg.com/vi/-jnfFdiXRRk/default.jpg","False","False","Eine traumhafte Erdbeertorte mit einer fruchtig-frischen Quarkfüllung.Rezept(20er Backform)Rührteig1 Ei30 g Zucker25 ml Öl50 g Mehl1/2 TL BackpulverBackzeit: 160 ° Umluft ca. 18-20 MinutenCreme150 g pürierte Erdbeeren250 g Quark (40 %)200 ml Sahne50 g Zucker1 P. Vanillezucker (8 g)4 Blatt GelatineBelag200 g ErdbeerenFruchtspiegel125 ml roter Saft (z.b. Johannisbeer, Kirsch, Trauben, Erdbeer)1,5 Blatt GelatineDeko1 TL Kokosflocken"
"g4D81gI_T70","Deutschland von oben 1945 - 5 Städte | Terra X","2020-05-07T14:00:28.000Z","UCA3mpqm67CpJ13YfA8qAnow","Terra X Natur & Geschichte",Science & Technology,"20.12.05","ZDF|Terra X|Doku|Hitler|Adolf Hitler|Weltkrieg|Zweiter Weltkrieg|Ausbruch|Angriffskrieg|Vernichtungskrieg|Holocaust|Kriegswende|Bombenkrieg|Totaler Krieg|Folgen|Europa|Deutschland|Deutsches Reich|Zerstörung|Luftbilder|Oben|Von Oben|Aliierte|Trümmerfrau|Berlin|Nazi|Reichsparteitag|Luftangriff|Sinterbims|Mont Blanc|Tonnen|Schutt|Asche|Tote|Düren|Nürnberg|Amerikaner|Russen|Zwangsarbeit|Köln|Luftbild|Drohne|Aerial View|Air|Worldwar|World War|WWII|World War II|Kapitulation","275079","5428","119","1269","https://i.ytimg.com/vi/g4D81gI_T70/default.jpg","False","False","Deutschlandweit haben im Bombenkrieg mindestens eine halbe Million Menschen ihr Leben verloren. Mehr als eine Milliarde Tonnen Schutt und Gestein  hinterlässt der Zweite Weltkrieg in Deutschland. Aufeinandergetürmt ist das ein Berg so hoch wie der Mont Blanc. Hitler hatte einen Vernichtungskrieg entfesselt, der am Ende auf das eigene Land zurückschlug.In vielen Stadtteilen Berlins sieht man 1945 die so genannten Trümmerfrauen, denn Männer fehlen, sind tot, vermisst oder in Gefangenschaft. Später beseitigen Maschinen und professionelle Baufirmen die Schuttberge. Die am meisten zerstörte Stadt in ganz Europa ist aber nicht Berlin, sondern Düren. Es wirkt bei Kriegsende wie zu Staub zermahlen. Als im Februar 1945 amerikanische Truppen Düren erreichen, leben nur noch vier Deutsche und 25 Zwangsarbeiter in der Trümmerwüste. Auch in Nürnberg, einst Stadt der Nazi-Reichsparteitage und Rassengesetze, legt im Januar 1945 ein schwerer Luftangriff die Altstadt in Schutt und Asche. Die vielen Rüstungsbetriebe machen Nürnberg zu einem wichtigen Angriffsziel. Nach der Einnahme durch die Amerikaner folgt zunächst eine gesetzlose Zeit. Vielerorts gilt das Recht des Stärkeren, die Kriminalität blüht.In der Domstadt Köln ist im Zentrum so gut wie kein Haus mehr bewohnbar. Dennoch liegt Köln, gemessen am Anteil des zerstörten Wohnraums, „nur“ auf Platz 12 der deutschen Städte – mit rund 70 Prozent Zerstörung. Von einst 770 000 Einwohnern leben in Köln bei Kriegsende noch rund 40 000 in der Stadt.Wie in vielen anderen deutschen Städten hat der Bombenkrieg auch in Frankfurt schwere Schäden hinterlassen. Während in anderen Städten bereits fleißig Trümmer geräumt werden, geschieht in Frankfurt aber erstmal nichts. Die Frankfurter gehen andere Wege und wollen eine möglichst hundertprozentige Recyclingquote erreichen. Aus dem Feinschutt wird sogar ein wertvoller Rohstoff gewonnen – der Sinterbims. Aus ihm entstehen neue Baustoffe, und aus der zerstörten Stadt entsteht buchstäblich das neue Frankfurt.Die ganze Folge Deutschland von oben - 1945 findet Ihr in der ZDFmediathek: https://www.zdf.de/dokumentation/zdfzeit/zdfzeit-deutschland-von-oben----1945-100.html#xtor=CS3-82Dieses Video ist eine Produktion des ZDF, in Zusammenarbeit mit History Media.Abonnieren? Einfach hier klicken – https://www.youtube.com/channel/UCA3mpqm67CpJ13YfA8qAnow?sub_confirmation=1Alle Filme und Infos zu Terra X gibt es hier – https://terra-x.zdf.de/#xtor=CS3-82Terra X bei Facebook – https://www.facebook.com/ZDFterraXTerra X bei Instagram – https://www.instagram.com/terraX"
"6Zchd0Yu7_M","Starlink - Elon Musk schickt tausende Satelliten ins Weltall | Breaking Lab","2020-05-07T16:00:04.000Z","UCE2hJ9CYR57BYhk3TjGVG6w","Breaking Lab",Science & Technology,"20.12.05","breaking lab|breakinglab|lab|Wissenschaft|Science|Jacob Beautemps|Phil's Physics|Experiment|Physik|Chemie|Biologie|Informatik|Wissenschaft News|Neuigkeiten|Experimente|mailab|clixoom|Deutsch|satelliten|space x|spacex|elon musk|starlink|weltall|weltraum|iss|nasa|sateliten|esa|Was ist Starlink|Leuchten am Himmel|Neue Satelliten|Nachthimmel|Astronomie|Problem durch Satelliten|Sateliten|42.000|Jeff Bezos|Technologie|Technik|Weltraumtechnik|Weltall|Weltraumschrott|Weltraummüll","168403","7593","226","1029","https://i.ytimg.com/vi/6Zchd0Yu7_M/default.jpg","False","False","Mit dem Projekt Starlink von Elon Musk soll mithilfe von tausenden Satelliten schnelles Internet überall auf der Welt verfügbar sein. Hunderte davon befinden sich schon im Erdorbit und haben seitdem extrem viel Kritik geerntet. Und auch ich habe mich gefragt: darf einfach jeder wie er lustig ist Satelliten ins All schicken? Dazu habe ich mich mit Professor Hobe von der Uni Köln getroffen und spannende Fakten recherchiert.Hier könnt ihr die Starlink-Satelliten finden:https://findstarlink.com/Breaking Lab bei Instagram: @breakinglabQuelle 1: https://www.spacex.com/abouthttps://www.spacex.com/falcon-heavyQuelle 2: https://www.scientificamerican.com/article/spacexs-starlink-could-cause-cascades-of-space-junk/Quelle 3: https://www.spacex.com/news/2020/04/28/starlink-updateQuelle 4: https://www.scientificamerican.com/article/the-fccs-approval-of-spacexs-starlink-mega-constellation-may-have-been-unlawful/Quelle 5: https://www.golem.de/news/starlink-satelliten-am-nachthimmel-1905-141547-2.htmlBildquellen:https://vimeo.com/338361997https://www.esa.int/Space_in_Member_States/Germany/Weltraummuell_Ein_ueberirdisches_Problemhttps://www.flickr.com/photos/spacex/40126461851/https://www.flickr.com/photos/spacex/40126462231/https://www.flickr.com/photos/spacex/39225582421/https://www.flickr.com/photos/spacex/27449863849/https://www.flickr.com/photos/spacex/40143096241/https://www.flickr.com/photos/spacex/40110297852/https://www.flickr.com/photos/spacex/40110298232/https://www.flickr.com/photos/spacex/47926144123/https://www.nasa.gov/multimedia/imagegallery/image_feature_1283.htmlhttps://www.flickr.com/photos/spacex/16512864369/https://www.flickr.com/photos/spacex/16510243060/https://www.infosat.de/technik/telesat-testet-weltweit-erste-5g-demo-bertragung-erfolgreich-ber-leo-satellitenhttps://flickr.com/photos/73449134@N04/47943839008https://www.flickr.com/photos/spacex/47926136902Ich bin Jacob Beautemps und mache gerade meinen Doktor an der Universität zu Köln. Vor drei Jahren habe ich zusammen mit Philip Häusser diesen YouTube Kanal gegründet und seit 2018 stehe ich nun selbst vor der Kamera. In meiner Forschung an der Uni geht es um das Thema What comprises a successful educational YouTube video?: the optimization of YouTube videos’ educational value through the analysis of viewer behavior and development via machine learning. Oder kurzgesagt: Wie lernt man auf YouTube und wie können wir das mit künstlicher Intelligenz optimieren. Dies fließt natürlich stark in meine YouTube Videos mit ein, denn hier geht es auch darum möglichst viel über Physik, Chemie, Technik und andere naturwissenschaftliche Themen zu lernen.Hat dir das Video gefallen? Klick auf Daumen hoch und lass ein Abo da! Dein Feedback motiviert mich zu neuen Videos. Dankeschön :-)"
"WDoG0PUj9ME","Freundschaft plus?!😱 Jannes heitert Vivi auf! #2187 | Berlin - Tag & Nacht","2020-05-07T18:15:00.000Z","UC6hmAN2FLzB8-Fzzu7evKgA","Berlin - Tag & Nacht",Entertainment,"20.12.05","berlin - tag & nacht|berlin tag und nacht|btn|rtl2|preview|ganze folge|tv now|Berlin|berlin tag und nacht preview|berlin tag und nacht ganze folge|berlin tag und nacht vorschau|tägliche highlights|rtlzwei|Matrix-WG|Jannes|Vivi|Emmi|Jannes und Vivi|Freundschaft|Freundschaft plus","698029","21853","367","776","https://i.ytimg.com/vi/WDoG0PUj9ME/default.jpg","False","False","Vivi ist krass fertig wegen Luke und Olivia! Wie können die beiden in der WG so rumturteln, während sie auch anwesend ist?! Zum Glück ist Jannes da, um sie aufzuheitern! Doch verstehen sich die beiden vielleicht zu gut? Hoffentlich ist Emmi nicht sauer…Die gescriptete Reality-Soap „Berlin - Tag & Nacht“ zeigt die coolste WG Berlins, mit Themen wie  Freundschaft, Liebe,  Eifersucht, Affären, Glück, Freude und Leiden. Wie im echten Leben eben!Alte wie neue WG-Bewohner, u. a. Ole, Joe, Peggy, Krätze, Schmidti, Eule, Basti Paula, Piet, Milla, Leon und viele weitere, zeigen dir ihr Leben in Berlin, der bunten Metropole Deutschlands. Sie nehmen dich mit in ihre Wohngemeinschaften, auf ihre Arbeitsplätze, in den Club Matrix, den Friseursalon „Schnitte“ sowie die Bar LA 14. Auch ein Tattoostudio und das Fitnessstudio Body Burn gehören zu den unterschiedlichen und wechselnden Handlungsorten der Serie. Die Großstadt-Soap „Berlin – Tag & Nacht“ ist nicht zuletzt deshalb so beliebt, weil sie die Bewohner der WGs im Ringen mit alltäglichen Problemen zeigt: Affäre und Eifersucht, Erfolgsdruck im Beruf sowie viele zwischenmenschliche Konflikte. Berlin - Tag & Nacht läuft Montag bis Freitag um 19:05 Uhr bei RTLZWEI. Instagram: http://www.instagram.com/berlintagundnachtZur Webseite: http://www.rtl2.de/sendung/berlin-tag-und-nachtKomplette Folgen auf TVNOW: http://www.tvnow.de/rtl2/berlin-tag-nachtZur BTN-App: https://www.rtl2.de/sendungen/berlin-tag-nacht/appFacebook: http://www.facebook.com/berlintagundnachtTwitter: http://twitter.com/rtl2"
"XZYox2_FQnI","Buchstabe für Buchstabe – Iss die Suppe in alphabetischer Reihenfolge  || Das schaffst du nie!","2020-05-07T13:00:42.000Z","UC6Nh0xrtXJfNGucGtVrqjHw","Das schaffst du nie!",People & Blogs,"20.12.05","Ari und Meini|Ari|Meini|Marc|Das schaffst du nie|DSDN|funk|Ariane Alter|Sebastian Meinberg|Marc Seibold|BR|Bayerischer Rundfunk|ARD|Buchstabensuppe|sortieren|Challenge|Community challenge|buchstaben sortieren|communitychallenge|corontäne|essen|abc|buchstabenchallenge|alphabet challenge","321011","15801","315","2991","https://i.ytimg.com/vi/XZYox2_FQnI/default.jpg","False","False","Die Community hat sich diese Challenge gewünscht und wir setzen Sie um! Diese Woche heißt es deshalb: Glatze für Marc... Ach ne. Heute kommt ja eine Challenge... Also: Iss die Buchstabensuppe in alphabetischer Reihenfolge. Hierfür bekommt Sebastian Meinberg 3 Stunden Zeit, um eine Schüssel Buchstabensuppe auszulöffeln, Buchstabe für Buchstabe... Kann Sebastian Meinberg das in der vorgegebenen Zeit schaffen oder schafft er das nie? ISS DIE BUCHSTABENSUPPE Was ergeben Buchstabennudeln, eine Suppe und Marcs Sabotagen? Richtig! Eine perfekte Challenge für Sebastian Meinberg! Die Regeln sind denkbar einfach. Die Buchstaben müssen in alphabetischer Reihenfolge gegessen werden und die Buchstaben müssen im Teller bleiben. Welche fiesen Gemeinheiten hat sich wohl Marc Seibold ausgedacht, um Meini am Gewinnen zu hindern? Wer wird nächste Woche bestraft? Das seht Ihr in der neuen Folge von „Das schaffst du nie!“ COMMUNITYWÜNSCHE WERDEN WAHR Nachdem Marc seine 72 Sozialstunden abgearbeitet hat, ist es wieder an der Zeit für eine neue Challenge. Dieses Mal ist Sebastian Meinberg dran, um eine echte Community Challenge zu meistern. Wieso Community Challenge? Ihr habt es Euch in den Kommentaren gewünscht und wir setzen die Challenge um! Habt Ihr eine tolle Idee für eine Challenge oder auch für eine Strafe? Dann ab damit in die Kommentare! #funk #dasschaffstdunie #dsdn #buchstabensuppe ******************************************************************** Ob 72h moderieren, eine Skischanze hochrennen oder eine Skulptur aus Eis schnitzen: Bei „Das schaffst du nie!“ stellt der fiese Redakteur Marc Seibold den zwei Hosts Ariane Alter und Sebastian Meinberg immer abwechselnd eine Challenge – gerne auch 24 Stunden lang. Schaffen die Hosts die Challenge, dürfen sie Marc bestrafen. Schaffen sie es nicht, müssen sie noch eine Bestrafung ertragen. Jeden Donnerstag um 15 Uhr gibt’s ein neues Video von „Das schaffst du nie!“. Heute: die Buchstabensuppen Challenge. Auf jede neue Challenge kommt am darauffolgenden Donnerstag die Bestrafung. Wer Sebastian bei der nächsten Challenge sehen möchte, klickt hier: https://www.instagram.com/heinz.wescher/ Und wer Marc folgen möchte, klickt hier: https://instagram.com/marc_cyborg ▬▬▬▬▬▬▬▬▬▬▬▬▬▬▬▬▬▬▬▬▬▬▬▬▬▬▬▬▬ Yo! Wir gehören auch zu #funk! Checkt da mal vorbei: Instagram: https://www.instagram.com/funk YouTube: https://youtube.com/funkofficial funk Web-App: https://www.funk.net/ Facebook: https://www.facebook.com/funk/ Impressum: http://go.funk.net/impressum"
"Dngw1IqEVag","Landet ein Flugzeug auf Malle - Flugsimulator | Spiel 2 | Joko & Klaas gegen ProSieben","2020-05-05T19:09:40.000Z","UCmoa-beOd9dBmZIiLVXB8Bw","Joko & Klaas",Entertainment,"20.12.05","Landet ein Flugzeug auf Malle - Flugsimulator|Landet ein Flugzeug auf Malle|Flugsimulator|flugsimulator|flugsimulator 2020|flugzeug joko und klaas|fliegen joko klaas|flugzeug start|flugzeug landen|flugzeug simulator|fliegen|flugzeug|Joko und Klaas gegen ProSieben|Joko gegen Klaas|Joko und Klaas Joko Winterscheidt|Klaas Heufer-Umlauf|Circus Halligalli|JKgegenP7|JKP7|MTV Home|neo paradise|Palina Rojinski|Oma Violetta|Olli Schulz","1025271","26888","737","1072","https://i.ytimg.com/vi/Dngw1IqEVag/default.jpg","False","False","Welcome on board of Joko & Klaas Airlines. Die Außentemperatur beträgt angenehme -10°, es drohen Unwetter und explodierende Triebwerke. Aber da unsere beiden Piloten in ihrem Leben noch nie in einem Cockpit gesessen haben, sollte all das kein Problem darstellen. Zum Glück handelt es sich nur um eine Flugsimulation, aber das macht die Aufgabe - Fliegt einen Airbus von Berlin nach Mallorca - nicht unbedingt einfacher. Achja, und Snacks gab's auch keine.#Flugsimulator #JKvsP7 #ProSieben„Joko und Klaas gegen ProSieben“ dienstags, um 20:15 Uhr auf ProSieben► Ganze Folgen: https://www.prosieben.de/tv/joko-klaas-gegen-prosieben► Joko und Klaas bei Facebook: https://www.facebook.com/jokoundklaas/► Folge uns auf Twitter: https://twitter.com/jokoundklaas► Instagram: https://www.instagram.com/jokoundklaas/ProSieben ist bereit für die Herausforderung! Zum ersten Mal treten Joko und Klaas gemeinsam im Team an und fordern einen ganzen Sender heraus. In der neuen Prime-Time-Showreihe „Joko & Klaas gegen ProSieben“ gilt es ab dem 08. Oktober, immer dienstags um 20:15 Uhr auf ProSieben, gegen das gesamte Universum der roten Sieben zu bestehen. Über die Gegner von Joko und Klaas und die Spiele entscheidet alleine ProSieben. Erstmals können auch die Zuschauer ihren Sender aktiv unterstützen: als Teil der Community treten auch Online-Bewerber im Studio gegen Joko und Klaas für ProSieben an._______________________Impressum:http://www.studio71.com/de/impressum/"
"61bsovfozsU","Vladuta Lupau - Apa trece, dar pietrele raman","2020-05-07T08:40:00.000Z","UC9q02x_vtrnmFikcRodI2eQ","Vladuta Lupau",Music,"20.12.05","vladuta lupau|vladuta|lupau|Vladuta Lupau - Apa trece dar pietrele raman|Apa trece dar pietrele raman|Apa trece|pietrele raman|apa|trece|pietrele|raman|vladuta lupau 2020|2020|vladuta lupau apa trece|apa terece pieterele raman versuri|vladuta lupau versuri|rapsozii maramuresului|rasozi|maramures|Prietenele mele HIT|prietene|mele|hit|FAIN II NUMELE MARIE|fain|nmume|marie|nou vladuta lupau|vladuta lupau live|live","1136047","30759","1056","1905","https://i.ytimg.com/vi/61bsovfozsU/default.jpg","False","False","Ne-am gândit că avem nevoie cu toții de muzică, și mai ales de unitate prin cântec. Vladuta Lupau - Apa trece, dar pietrele ramanMelodia este cântată live, linia fiind preluată din repertoriul doamnei Sava Negrean Brudașcu.Aboneaza-te pentru noutati: https://bit.ly/2TYaZhnVladuta Lupau - Apa trece, dar pietrele ramanPentru că acum, mai mult ca niciodată toți simțim la fel, acest cântec, l-am gândit pentru această vreme, iar textul a fost scris de mine din trăirile acestei vremi. Sper ca dumneavoastră să primiți cu drag acest mesaj muzical! Vladuta Lupau - Apa trece pietrele raman (versuri)Sunt acum în lume Vremuri de amarOrice-ai vrea să faci totul e-n zadarAu venit vremuri grele, vremi de pribegieCând în toată lumea este pandemieToți speram acum la vremuri mai buneSă putem ieși fără mască-n lume Timpul di’nainte, noi nu l-am prețuitNe plângeam într-una și uite pățitTrecut-au zile sfinte,cum n-au mai fost vreodatăCu biserici goale și lume-n dureratăToți românii noștri vrut-au să vină-n țarăUnul lângă altul să poată sta iarăVrem să ieșim pe stradă, cum o făceam mereuDe stat numai în casă, la toți ni tare greu Nu s-a mai întâmplat în lume niciodatăSă ne fie greu și la toți deodată Acum când Toți suntem, de boală amenințați Bunicii și părintii, trebuie protejați Când virusul va trece, și-om știi Că nu mai vine N-om mai sta izolați, și totul va fi bine!Mai mereu cu zâmbetul pe buze, artista Vlăduța Maria Lupău este dovada incontestabilă că folclorul românesc este respectat, promovat şi dus mai departe de generaţia tânără a României. La doar 25 de ani, Vlăduța a ajuns să fie cunoscută atât pe plan naţional, cât şi pe plan internaţional.De-a lungul carierei sale, tânăra a câştigat numeroase premii dintre care amintim: Premiul I – Festivalul Național „Rapsodia Românească”; Premiul I – Festivalul Național „Maria Lătărețu”; Premiul III – „Strugurele de Aur”; Marele Premiu „Festivalul Național de Cătănie”; Marele Premiu „Maria Tănase” sau Premiul de Popularitate „Mamaia Folclor”.Vladuta LupauPentru concerte , evenimente private/BookingMail: contact.vladutalupau@gmail.com ; Telefon: 0736 762 722 Facebook: https://www.facebook.com/vladutalupau/Twiter: https://twitter.com/VladutaLupau/Instagram: https://www.instagram.com/vladutalupau/Alaturi de acest nou videoclip Vladuta Lupau - Apa trece, dar pietrele raman  va mai recomandam:Vladuta Lupau - Prietenele mele HIT   https://bit.ly/2krQr1bVladuta Lupau si Rapsozii Maramuresului - Am prieteni de valoare - Colaj de petrecere 2020https://bit.ly/35JnL6XVladuta Lupau și Rapsozii Maramureșului - Colaj Etno 2017https://bit.ly/2mrYJXvFAIN II NUMELE MARIE - VLADUTA LUPAU  https://bit.ly/2kUyF6UAboneaza-te pentru noutati: https://bit.ly/2TYaZhn"
"rI8s2R4Q6Sw","Charlotte de Witte B2B Enrico Sangiuliano Livestream","2020-05-07T19:22:42.000Z","UC-yOW3e6zBSo1JwLXq46Suw","Charlotte de Witte",Music,"20.12.05","[none]","308640","13808","204","813","https://i.ytimg.com/vi/rI8s2R4Q6Sw/default.jpg","False","False","Charlotte de Witte & Enrico Sangiuliano streaming live from Ghent. Download on SoundCloud: https://soundcloud.com/charlottedewittemusic/charlotte-de-witte-b2b-enrico-sangiuliano-lockdown-livestream-may-2020https://www.facebook.com/charlottedewittemusichttps://www.instagram.com/charlottedewittemusichttps://www.soundcloud.com/charlottedewittemusichttps://www.residentadvisor.net/dj/charlottedewitte-behttps://www.charlottedewittemusic.com@CharlottedWitte"
"jfu0TZJ_iYQ","Jala Brat x Buba Corelli - KARANTIN","2020-04-12T09:58:20.000Z","UCaWaxupwQ7Pssm94Xcxi8LA","IMPERIA",Entertainment,"20.12.05","[none]","14377706","184242","11494","9620","https://i.ytimg.com/vi/jfu0TZJ_iYQ/default.jpg","False","False","✔ Social Media:https://emdc.yt/imperiahttps://emdc.yt/jalabrathttps://emdc.yt/bubacorelli✔ Stream & Download:https://emdc.yt/karantinMuzika i tekst: JALA BRAT, BUBA CORELLIAranžman: Rimda Mix Master:  KC Gitare: Mensur SalkanovicVideo: LjubbaBUBA CORELLI: BRANE TE, BRANE TE, BRANE ONE PRAVE JE PLJUJU RAVE TE, PRAVE RAZNE ZAVJERE KRALJICE TAME SVE, VOLE TE I HVALE TE DAJU LAZNE SAVJETE, PRETVORE SE U AVETE KUD NISAM NJEN, DZEP NA KAPUTU DA UGRIJEM DA JOJ UGRIJEM RUKU I LUIJEM  NE MOGU SE ISKUPIT ZA TUGU  NA TREN OPROSTI MI DRUGU IJE IJE  NJENO SRCE JE KO ARENA  NESHVACENA CE OSTAT KAO MALENA ONA OSTAT CE NESHVACENA  JER TU ODAVNO ZA NJU SRECE NEMA   JA SAM ODAVNO BACIO SVE KARTE NA STO A OKO TEBE SVE ME PODSJECA NA FIJASKO OD KADA VIDIO SAM TE OD TADA NISAM NI ZASPO A I NOCAS TRAZIM LICE STO SE KRIJE POD MASKOM A JA BI SAMO DA TE OCI PAMTIM MAKAR S NJIMA MORO U KARANTIN A JA BI SAMO DA TE OCI PAMTIM MAKAR S NJIMA MORO U KARANTIN  I KAD GOD TE VIDIM SRCE HVATA ME JEZA ZATO OSTAO BI TU 0-24 VEZAN  JALA BRAT: DA DA SU RIJECI SIJECIVA I DA BOLE BAS E KAO NOZ U LEDJIMA TI NAJBOLJE ZNAS E KOLIKO SI LIJECILA SUZAMA TU LAZ E TEBI NE TREBA SPONZOR I SAMA SI JAKA I KAD DUSA JE MORDOR I NEMAS ZA ZRAKA I KAD SRCE BI MODRO STALO BEZ ZNAKA TI POLETI KO KONDOR I KAD CEKA TE ZAMKA  TIJELA SU NAGA VISOKI NAPON O MOJA DIABLA OPET KRSIMO ZAKON DRZI ME JAKO HODAMO MRAKOM   NOCAS BUDI MI JAKA I KAD NIJE NAM LAKO  JA SAM ODAVNO BACIO SVE KARTE NA STO A OKO TEBE SVE ME PODSJECA NA FIJASKO OD KADA VIDIO SAM TE OD TADA NISAM NI ZASPO A I NOCAS TRAZIM LICE STO SE KRIJE POD MASKOM  A JA BI SAMO DA TE OCI PAMTIM MAKAR S NJIMA MORO U KARANTIN A JA BI SAMO DA TE OCI PAMTIM MAKAR S NJIMA MORO U KARANTIN I KAD GOD TE VIDIM SRCE HVATA ME JEZA ZATO OSTAO BI TU 0-24 VEZANContact for YouTube, Distribution, Product placement, PartnershipsE-mail: imperia@emdcnetwork.comContact for covering our songs:E-mail: office@rfapublishing.com© IMPERIAYouTube & Digital distribution:EMDC Network✔Facebook: http://emdc.yt/EMDCFB✔Instagram: http://emdc.yt/EMDCIN✔Web: http://emdcnetwork.com"
"38pCDICYvTk","MY NEW BIKE SPONSOR | Elias Schwärzler 2020","2020-05-07T13:00:11.000Z","UCGWOKYF5sq1iDkiScn-krPw","Elias Schwärzler",Sports,"20.12.05","Specialized|Jump|Downhill|Elias Schwärzler|Bikepark|freeride|brandnertal|MTB|bike|gopro|dh|mountain bike|enduro|Sick Series|Fabio Wibmer|whip|fahrrad|magura|schwärzler|ride|trails|Shred|first|wheelie|crash|first ride|bicycle|bikes|racing|Biking|backflip|riding|Cycling|fahrrad fahren|freestyle|Mountainbike|Downhillbike|wibmers law|home office|Fabio|Wibmer|mtb|downhill|fabwibmer|mountainbiking|biking|mtb freeride|red bull|wibmerfabio|urban|scott|gambler","104124","9886","93","506","https://i.ytimg.com/vi/38pCDICYvTk/default.jpg","False","False","Proud to announce my new Bike Sponsor - Scott Sports. I´m absulutely in love with this costum painted Bike and I can´t wait to shred themCheers Scott for believing in me - the future is gonna be great!Video and Editing by Fabian Lins (https://www.fabian-lins.com/)Photos taken by Luca Fasching  (https://www.fasching.photo/)Thanks also to Arno Lins for assisting.Music:1. Song: Relaxation by Geva Alon2. Song: Temporary Home by Mayalsac▶︎Instagram: elias_schwaerzlerhttps://www.instagram.com/elias_schwaerzler/▶︎Facebook: Elias Schwärzlerhttps://www.facebook.com/elias.schwarzler▶︎Youtube: Elias Schwärzlerhttps://www.youtube.com/channel/UCGWOKYF5sq1iDkiScn-krPw▶︎Snapchat: elisch9#Bike #Sponsor"
"qloV1QSgi7g","Assassin’s Creed Valhalla: First Look Gameplay Trailer","2020-05-07T15:32:55.000Z","UC0KU8F9jJqSLS11LRXvFWmg","Ubisoft",Gaming,"20.12.05","assassins creed|assassin’s creed|assassin’s Creed valhalla|valhalla|open world|open world game|adventure|ubisoft|Vikings|gameplay|saxon|CGI|cinematic|world premiere|first gameplay|xbox serie X|ps5|playstation 5|xbox|playstation|pc|Ubisoft trailer|new assassins creed|assassin’s creed ragnarok|assassin's creed 2020|assassins creed 2020|AC valhalla|AC|assassin's creed vikings|assassin's creed odyssey|Ac ragnar|vikings|assassins creed ragnarok","744873","29650","21177","5931","https://i.ytimg.com/vi/qloV1QSgi7g/default.jpg","False","False","Ninth century A.D. Driven from Norway by endless war and dwindling resources, a Viking raider, Eivor, leads a clan of Norsemen across the icy North Sea to the rich lands of England’s broken kingdoms. Their mission: establish a new, permanent home, no matter the cost. Assassin’s Creed Valhalla will be available Holiday 2020 on Xbox Series X, Xbox One, PlayStation®5, PlayStation®4, Epic Games, Uplay and Stadia. Pre-order now at https://store.ubi.com/Pre-order now and get an additional mission: The Way of the BerserkerFollow Assassin’s Creed:WEBSITE: https://www.assassinscreed.comFACEBOOK: https://www.facebook.com/assassinscreed.uk/TWITTER: https://twitter.com/Assassins_UKINSTAGRAM: https://www.instagram.com/assassins_uk"
